utah man hospitalized after winning eggnog chugging contest,741,agree
rcmp release security footage of michael zehaf bibeau during attack say he shot soldier in back,2246,agree
nicaragua asks for help investigating meteorite crater,1594,disagree
see it california homeless man uses 100 gift to give food to others,1922,discuss
tropical spider burrowed under man skin through appendix scar and lived there for three days,1819,agree
cnn posts alleged audio of michael brown shooting,721,discuss
iraqi media says isis militants have contracted ebola,1807,discuss
boko haram could release kidnapped girls nigerian officials say,1430,discuss
reports big bank hank of pioneering rap group sugarhill gang has died,2351,discuss
confusion swirls details murky in arrest of isis leader,2337,discuss
enormous catfish caught with fishing rod in italy after boat battle,2161,agree
meteor leaves crater near managua airport,1622,discuss
cloistered nun gives birth to a baby the convent there is a sister google translate,1828,discuss
cheese addiction breaks kim ankles,1854,discuss
vice media ceo shane smith spent on las vegas dinner report,167,discuss
insurgents killed in nigeria despite alleged truce with boko haram,1298,discuss
is the iphone 6 really pulling out your hair,1769,discuss
nigeria and boko haram ceasefire and girls release,1430,discuss
mum offers to sell twin boy to save twin girl,886,agree
cnn airs alleged audio from michael brown shooting,2317,discuss
nigeria says ceasefire agreed with boko haram,2139,discuss
vice squad 1m win lights up las vegas,1791,agree
us hostage by militants in yemen says hagel,1649,discuss
more american weapons for isis,2168,discuss
pope francis turns out not to have made pets in heaven comment,289,disagree
small meteorite strikes in nicaragua capital city of managua,601,disagree
who investigates media reports isis fighters contracted ebola,1506,discuss
isis reportedly beheads american photojournalist in iraq,991,discuss
report nigerian woman quarantined in kc with symptoms video,2501,discuss
nigeria says it has deal with boko haram to release kidnapped girls,531,discuss
breaking news photojournalist held hostage by killed in failed rescue attempt in yemen,1649,discuss
report nigerian woman quarantined in kc with symptoms video,51,discuss
angry mob chops off man genitals with butcher knife for alleged rape attempt,654,discuss
fears islamic state could launch ebola attack on britain after fighters virus,1689,discuss
nbc weatherman caught urinating in the woods live on air,975,disagree
elon university has not banned the term despite rumors,1508,agree
police find mass graves with at least bodies near mexico town where 43 students disappeared after police clash,1822,discuss
is kim sister now the power behind the north korean throne,780,discuss
isil video claims beheading of kidnapped journalist james foley,2147,discuss
return of the mac seth rogen in talks to star as apple steve wozniak in upcoming steve jobs biopic,1575,discuss
new audio shows michael brown was shot at 11 times,1009,discuss
amazon is opening a store in manhattan,737,discuss
macaulay culkin dead hoax fake death report spreads on social networks,1752,agree
ottawa shooting kevin vickers hailed a hero for shooting rampaging gunman,1666,agree
rumor seth rogen to appear as woz in sony steve jobs film,851,discuss
breaking news isis beheads missing american journalist james wright foley as warning to us to cease action in iraq,1658,agree
us drones hunting for isis leader seen flying over syrian airspace,1740,agree
this is a truly horrifying story about a spider,1923,disagree
indian civil servant sacked sickie,1162,agree
rumor debunked robots are not patrolling microsoft campus,1837,disagree
boko haram denies nigeria claim,2191,discuss
teen makes 72 million on the stock market,1781,discuss
apple watch reportedly has reserve mode,1911,discuss
continuing violence puts boko haram ceasefire in jeopardy,531,discuss
batman superman batmobile stolen,1242,discuss
hairgate reports of iphone 6 pulling out hair beards likely exaggerated,2476,discuss
lynch mob use butcher meat cleaver to castrate rapist they caught attacking teenage girl in alleyway in indian city,2115,agree
report nigerian woman quarantined in kc with symptoms video,2127,discuss
woman stays in kfc for a week to get over her,2414,agree
islamic state leader family detained by lebanon officials say,931,discuss
fidel castro death watch rumors heat up cuba denies,2251,discuss
that boko haram ceasefire in nigeria is a ceasefire,2463,discuss
boko haram release abducted schoolgirls as part of ceasefire agreement,2356,discuss
canadian soldier shot at ottawa war memorial report,1437,discuss
rumor gold apple watch edition priced up to steel version at 500 will debut on 14,2365,discuss
parents are furious after seven girls aged fall pregnant on a school trip,1804,agree
iraqi media isis militants have contracted ebola,1615,discuss
customer i was fired for comcast complaint,2133,discuss
would you pay for the apple watch,645,discuss
apple on macbook air,2497,discuss
michael brown shooting audio caught on tape,944,discuss
who says reports of suspected ebola cases in iraq are untrue,2003,discuss
hoax alert father who has met god and thinks she a woman is made up just like god herself,2515,disagree
is kim sister now the power behind the north korean throne,2313,discuss
chugging eggnog at office party lands man in hospital,1901,agree
the guy who said a spider burrowed under his skin experts,1860,discuss
islamic state militants claim to have beheaded us journalist james wright foley,2524,discuss
mass grave found after 40 students disappear in mexican protest,443,discuss
mohammed islam denies making 72 million from stock market trading,1760,discuss
continuing violence puts boko haram ceasefire in jeopardy,1821,discuss
video islamic state claims to have captured us weapons airdrop near kobane,2295,discuss
north korea dictator kim undergoes surgery after breaking both ankles on military tour,2417,discuss
alleged audio of michael brown shooting has surfaced,2149,discuss
web of confusion as scientists cast doubt on man claims that a spider burrowed into his stomach through his scar,1864,discuss
reports isis fighters have contracted ebola are says iraqi health ministry,2003,discuss
video appears to show beheading of journalist james foley who went missing in syria,1966,discuss
source tom brokaw wants brian williams fired,1507,discuss
isis militants have contracted ebola iraqi kurdish media reports,1891,discuss
despite no ebola case in kansas city the rumor goes viral,1943,agree
accidentally delivered weapons to the islamic state by airdrop militants say,1120,discuss
jeh johnson politicians should the flames of fear over isis ebola,2093,discuss
kim broke both ankles and is hospitalized report claims,1001,discuss
this is why rumors that isis is crossing the border into the are going away,1376,discuss
obama outraged over beheading vows to stay on course,1679,discuss
unconfirmed reports claim gill rosenberg captured by isis,1862,discuss
pants on fire duncan hunter makes unconfirmed claim border patrol caught at least 10 isis fighters,1890,agree
islamic state releases video apparently showing the beheading of missing us journalist james foley,578,discuss
are missing students in mass graves found near iguala mexico,1156,discuss
female israeli fighter said abducted by islamic state read more female israeli fighter said abducted by islamic state,2302,discuss
cnn audio is this the moment michael brown was shot,2317,discuss
explosion reported near the nicaraguan capital attributed to meteorite impact but experts including nasa cast doubt on claims,1722,discuss
a new ios 8 bug can delete all of your icloud documents,2054,discuss
jilted lover spends a week in kfc to try and get over her ex,2043,agree
islamic state releases video apparently showing the beheading of missing us journalist james foley,337,discuss
michael slain ottawa shooter had criminal record in quebec,1554,agree
eyewitness says viral video of homeless man was staged,1971,agree
islamic state training pilots in military jets monitors say,1608,discuss
nun gives birth intends to keep baby,2492,agree
watch us marine saved by helmet after being shot by taliban sniper,743,agree
isil militant john named by media,2349,discuss
lol rich johnston says the batmobile has been stolen in detroit,1737,discuss
nigeria missing girls be released by boko haram government aide claims,2356,discuss
james wright foley kidnapped journalist apparently executed by isis,1093,discuss
pictured heroic 58 walking through parliament gun in hand just moments after he killed gunman michael,1472,discuss
canada probes michael as possible suspect in ottawa shooting source,1866,discuss
missing american journalist reportedly beheaded by islamic state,928,discuss
youngest martyr the cub of isis boasts a fighter has been killed as he went into battle with his father in syria,125,discuss
moment marine is saved by his kevlar helmet as taliban sniper bullet hits him in head,743,agree
apple watch reportedly features unannounced diagnostics port under strap connector,1455,discuss
weather reporter caught writing his name in the snow was not ready to go on camera updated,975,disagree
jose canseco accidentally shot himself in the hand,2000,discuss
is durex planning to release a pumpkin spice condom,1400,discuss
lebanon confirms holding isis chief kin,2155,discuss
christian bale in talks to play steve jobs in danny boyle biopic,1226,discuss
obama administration denies congressman claim that least ten isis fighters have been caught coming across the mexican border in texas,666,agree
jihadi john unmasked islamic state killer named as west londoner mohammed emwazi,1939,discuss
meteor leaves crater near managua airport,2154,discuss
horror isis fighters have reportedly contracted ebola,2060,discuss
audio of gunfire in michael brown case authenticated by app company,2317,discuss
new audio reveals pause in gunfire when michael brown was shot attorney,2235,disagree
reports jihadists steal commercial jets raise fears,2448,discuss
moment michael brown was shot dead on audio recording fbi handed potentially damning tape of eleven shots being fired including final volley of shots,2434,discuss
nigeria claims deal with boko haram on ceasefire kidnapped girls,1681,discuss
snowmen declared as snow falls in saudi arabia,1498,discuss
james foley missing american photojournalist reportedly executed by isis in syria,608,discuss
continuing violence puts boko haram ceasefire in jeopardy,455,discuss
michael slain ottawa shooter had criminal record in quebec,1380,agree
nasa raises doubts about reports of nicaraguan meteorite,1594,agree
angry mob cut off rapist penis with meat cleaver viewer discretion,1476,discuss
pga tour denies claim that tiger woods failed a drug test,757,agree
apple to take reservations for trying on apple watch considered platinum model,1291,discuss
pope francis tells boy whose dog had died that heaven is open to all,2297,agree
urgent isis leader abu bakr allegedly killed by us airstrikes,1522,discuss
fence jumper reportedly made it much further into white house than secret service said,1488,discuss
james foley missing american photojournalist reportedly executed by isis in syria,1744,discuss
ebola scare in kansas city,2104,discuss
confusion as cuba castro mourned instead of kenya fidel,2399,discuss
islamic state may have fighter jets now after seizing migs,1341,discuss
vladimir putin motorcade looks like a massive knob,2391,agree
everybody relax banksy was arrested and exposed as a man,2468,agree
ypg confirms gill rosenberg not captured in kobani,1899,discuss
kevin vickers hailed as hero for reportedly shooting gunman inside parliament,1900,discuss
paul rudd helped tackle a violent homophobe so that another reason to love him update,609,agree
rumor gold apple watch edition priced up to steel version at 500 will debut on 14,1983,discuss
ebay working on bidding app for apple watch,1397,discuss
is durex planning to release a pumpkin spice condom,1060,discuss
apple was forced to nix key health features from its smartwatch report,1788,discuss
james foley beheading london rapper turned jihadist believed to be under investigation for murder of journalist in syria,2327,discuss
cnn posts alleged audio of michael brown shooting,816,discuss
report claims kim underwent surgery to repair fractured ankles,2153,discuss
boko haram denies leader says he married off kidnapped girls,2356,discuss
see it isis militants caught trying to cross border into texas congressman claims,2249,discuss
big bank hank of the sugarhill gang is dead at 57,2080,agree
isis reportedly beheads american photojournalist in iraq,1679,discuss
an accidental delivery of arms to the islamic state and the problem with airdrops,2295,discuss
iraqi health official ebola has killed 5 isis fighters,1778,discuss
nujaifi condemns daash crime in saqlawiyah and alsiger areas of anbar,2224,discuss
report jetliners stolen from libya could be used to attack on,1312,discuss
james foley remembered as and tireless journalist,933,discuss
canseco accidentally shot at his home tonight,1145,discuss
police hunt wearing man who slaps shoppers for sneezing,1155,agree
report alleged new audio of michael brown shooting,2481,discuss
isis militants appear to behead abducted american journalist james wright foley in graphic video,2147,discuss
isis beheads american journalist,2386,agree
ottawa investigates reports that isis has captured woman,346,discuss
isis fighters seize weapons airdrop meant for kurds,1597,agree
meteorite leaves crater in nicaraguan capital managua,2475,disagree
university drops term replaces it with,2321,discuss
nigeria hopes for return of kidnapped schoolgirls rise after ceasefire reported,520,discuss
nigeria says it has deal with boko haram to release kidnapped girls,1027,discuss
nun who gave birth no idea she was pregnant,899,agree
new audio recording from ferguson may capture michael brown shooting,816,discuss
angry mob chops off man genitals with butcher knife for alleged rape attempt,805,agree
tom brokaw brian williams out nbc legend at iraq war lie as it claimed executives warned anchor to stop exaggerating the story in the past,2176,discuss
bigfoot strolls through a russian forest at least that the claim video,1656,discuss
john isis fighter named as mohammed emwazi from west london,2349,agree
unconfirmed isis claims kayla mueller american female hostage is dead,1881,discuss
meet the teletubbies sun baby jess smith reveals herself as the smiling face who looked over teletubbyland,2284,discuss
islamic state declares captured aid worker to be,2254,discuss
isis video purports to show beheading of british aid worker,1757,discuss
nigeria boko haram blamed for raids despite truce claim,1298,discuss
michael brown shooting audio caught on tape,1934,discuss
texas hold,1467,discuss
woman by isis says she is and secure,2037,agree
cold turkey,2172,agree
north dakota names landfill after obama,1170,disagree
ebay is planning an apple watch app,952,discuss
nun gives birth to surprise baby after complaining of stomach pains,899,agree
media outlets identify john,831,discuss
ottawa gunman identified as michael,1331,agree
small meteorite strikes nicaragua government says,1661,discuss
cloistered nun gives birth to a baby the convent there is a sister google translate,706,discuss
unconfirmed isis claims kayla mueller american female hostage is dead,2376,discuss
senior western intelligence official confirms london rapper abdel majed abdel bary is a suspect in the foley killing,1079,discuss
that was fast christian bale bails on steve jobs biopic,755,agree
80 brat pack star judd nelson forced to deny that he dead after fake news story starts trending on social media,2278,agree
british hostage david haines beheaded by islamic state terrorists,2241,discuss
the case of the stolen batmobile has been solved,1528,discuss
cbs news names canadian parliament shooting suspect,2214,discuss
durex is not making pumpkin spice condoms after all a hoax debunked,2252,agree
shots heard in alleged brown shooting recording audio,1009,discuss
is apple about to launch a totally redesigned macbook air,1730,discuss
dogs do go to and cats and horses pope assures young boy that there is a place in paradise for animals as well,1905,agree
is kim jong un sister kim yo jong in charge,2477,discuss
woman catches husband cheating with her twin humiliates them,1852,agree
giant 8ft 9in catfish weighing 19 stone caught in italy is thought to be the biggest ever reeled in with a rod and line,1028,agree
batmobile stolen from v superman dawn of justice set report claims that one of the batmobile models is missing detroit locals responsible,266,discuss
dylan thomas finds tropical spider burrowed under skin,1502,agree
breaking isis beheads american journalist james wright foley,2450,agree
small meteorite strikes nicaragua government says,1661,discuss
video messaging service verifies timing of cnn audio recording,2250,discuss
these egalitarian lego instructions from the 1970s are pretty cool but are they real,2171,discuss
kanye west barred from all future awards shows,514,disagree
christian bale drops out of steve jobs biopic,2211,agree
teen made 72 million trading stocks confirms teen dominance worldwide,1760,discuss
despite no ebola case in kansas city the rumor goes viral,1343,agree
kim drinks rare snake wine to boost love life,1827,discuss
it okay to laugh about the fact that the vogue rat infestation is getting worse,2498,agree
nun complains of stomach pains and gives birth sister who had idea she was pregnant has a baby boy at hospital in italy,2492,agree
horror isis fighters have reportedly contracted ebola,2138,discuss
report audio reveals pause between gunshots when michael brown was shot,2434,discuss
lynch mob castrates alleged rapist in rajasthan,654,discuss
islamic state leader family detained by lebanon officials say,2155,discuss
james foley beheading london rapper turned jihadist believed to be under investigation for murder of journalist in syria,1598,discuss
kim obese leader both ankles,2053,discuss
now the vogue rats are chewing through couture,2106,discuss
mps credit for saving lives in parliament hill shootings,1631,discuss
isis beheading of journalist james foley posted to youtube,1011,discuss
small meteorite strikes nicaragua government says,2475,discuss
homeland security no isil fighters on border,1931,disagree
predator drone reportedly spotted over isis stronghold,1740,discuss
audio recording allegedly captures at least 10 shots fired in michael brown killing,1818,discuss
kim surgery on fractured ankles,493,discuss
amazon to launch first store report says,1772,discuss
gill rosenberg woman feared kidnapped by isis says she safe,1976,agree
nigeria says ceasefire agreed with boko haram,1630,discuss
people on twitter think macklemore has joined isis,1483,discuss
n korean leader misses annual ritual sister over duties,817,discuss
watch bird launches airstrike on putin shoulder updated,1813,disagree
no banksy has been arrested,1739,agree
small meteorite strikes nicaragua government says,961,discuss
teen made 72 million trading stocks confirms teen dominance worldwide,2407,disagree
saudi arabian cleric issues fatwa against snowmen,1498,discuss
ottawa gunman identified as michael,564,discuss
the man who says comcast got him fired has filed a lawsuit,2405,discuss
kim had ankle surgery source,1001,discuss
a message from jim mom diane foley,1747,agree
female teacher facing sack after making sex tape with teenager,1018,agree
mystery man slaps shoppers around head for sneezing,438,agree
pope francis turns out not to have made pets in heaven comment,82,agree
christian bale is steve jobs,1157,discuss
ypg confirms gill rosenberg not captured in kobani,714,discuss
boko haram denies truce says kidnapped girls have been,1821,agree
fears journalist james wright foley beheaded by islamic state jihadists in to united states,880,discuss
is kim really opening a restaurant in scotland,350,discuss
apple watch launch expected in late march,752,discuss
apple watch pricing will you spend 5000 for gold edition 500 for stainless steel,1983,discuss
that boko haram ceasefire in nigeria is a ceasefire,1340,agree
yemen says man freed sister says he dead,1844,discuss
islamic state releases video apparently showing the beheading of missing us journalist james foley,1116,discuss
reports big bank hank of pioneering rap group sugarhill gang has died,2080,discuss
female teacher facing sack after making sex tape with teenager,482,disagree
jess smith 19 claims she was teletubbies giggling baby what did she get paid,615,discuss
police hunt wearing man who slaps shoppers for sneezing,634,discuss
audio recording of michael brown being gunned down was made at the time he was killed app company appears to confirm tape of eleven bullets being fired including final volley of shots,2481,discuss
alleged audio of michael brown shooting released,2235,discuss
isil beheads american photojournalist in iraq,1093,discuss
no there are any ebola cases in iraq,1175,agree
no banksy did create that hebdo tribute cartoon but that does mean you ca appreciate it,2375,agree
who is michael ottawa shooter suspect identified by canadian officials,2246,agree
audio of gunfire in michael brown case authenticated by app company,2345,agree
kim surgery on fractured ankles,2022,discuss
has ebola infected isis militants in mosul,1040,discuss
batmobile stolen from batman v superman dawn of justice set zack snyder knows who did it,266,discuss
news sites fall for putin video,1438,discuss
cheeky vandals paint giant penis on bonnet of million bugatti veyron sportscar,1144,discuss
rare sighting of anna wintour without her trademark sunglasses as she leaves vogue office,2072,discuss
an audio recording of the michael brown shooting has reportedly surfaced,1446,discuss
iraqi official dismisses reports that isis fighters have ebola,2075,discuss
isis claims to behead us journalist,1288,discuss
dog abandoned at ayr station with belongings in suitcase,1164,agree
isis leader abu bakr and son detained in lebanon,2337,discuss
macaulay culkin not dead facebook twitter death hoax goes viral,759,agree
update batman v superman batmobile reportedly stolen by shocker detroit locals,266,discuss
alleged audio of michael brown shooting released,2220,discuss
rats at vogue nyc offices watch your step anna wintour,2106,discuss
rumor seth rogen to appear as woz in sony steve jobs film,1002,discuss
isis executioner john identified as mohammed emwazi,1780,discuss
kim broke both ankles and is hospitalized report claims,1480,discuss
isis claims to have intercepted supplies from airdrop,2307,discuss
tropical spider burrows under man skin through scar,2293,discuss
isis kills 300 iraqi soldiers with chlorine gas shia mp,2002,discuss
search launched for dog owner after pooch found dumped next to suitcase filled with belongings,626,agree
fears islamic state could launch ebola attack on britain after fighters virus,688,discuss
boko haram agrees to ceasefire release of school girls,2356,discuss
michael abdul zehaf bibeau pictures photos of alleged gunman in canada,1970,discuss
michael phelps girlfriend was born male but did not tell swimmer about her past,1029,agree
north korean leader kim not missing just having ankle surgery,1001,discuss
isis reportedly beheads journalist james wright foley on camera,2096,discuss
saudi cleric issues fatwa on snowmen,2456,agree
islamist militants 11 commercial planes in libya sparking terror attack fears,653,discuss
islamic state claims it executed american photojournalist james foley,2450,discuss
ebola outbreak 2015 update isis fighters may have contracted deadly virus,639,discuss
christian bale will not play steve jobs,1299,agree
wars the force awakens may get an early release,381,discuss
missing libyan jetliners raise fears of terror attacks on,1865,discuss
a message from jim mom diane foley,2495,discuss
islamic state claims to have beheaded american journalist,903,discuss
mass graves found in mexico near place where 43 students went missing,1613,discuss
attorney new audio reveals pause in gunfire when michael brown was shot,2434,discuss
ottawa shooting soldier shot at canada national war memorial,2281,agree
us hostage luke somers dies after rescue bid,1119,discuss
cnn plays alleged recording of michael brown shooting,2220,discuss
missing american journalist reportedly beheaded by islamic state,880,discuss
is ebola virus spreading among isis militants reports claim jihadists seeking cure at mosul hospital,992,discuss
cnn plays alleged recording of michael brown shooting,2250,discuss
elderly woman arrested for kidnapping neighbor cats making fur coats,2451,agree
dog found abandoned outside railway station with suitcase of his belongings,626,agree
this is a truly horrifying story about a spider,2338,discuss
detroit police issue statement that the batmobile is safe,1737,agree
are missing students in mass graves found near iguala mexico,1795,discuss
isis getting ebola,2180,disagree
nigeria says it has deal with boko haram to release kidnapped girls,1540,discuss
see how this homeless man spends a hundred dollars and keep a tissue handy video,1429,discuss
jihadi john as british man from west london,1939,discuss
iphone game developer quits job by hiding the greatest letter of resignation ever inside his game,1726,disagree
jeh johnson shoots down duncan hunter assertion is is entering via mexico,871,discuss
christian bale to play steve jobs in upcoming biopic,1215,agree
north korea dictator kim to open a new restaurant in scotland,1873,discuss
nigeria and boko haram ceasefire and girls release,1540,discuss
mass grave found after 40 students disappear in mexican protest,1427,discuss
woman detained in lebanon is not wife iraq says,1267,discuss
that was fast christian bale bails on steve jobs biopic,729,agree
