pumpkin spice condoms and 6 other flavors that are happening,1985,discuss
woman reportedly kidnapped by isis jerusalem post,1774,discuss
kim fat he has fractured his ankles,2022,discuss
isis beheads photojournalist james wright foley in a massage to us to end its intervention in iraq,1206,agree
boyfriend cuts off his penis and throws it in the bin after girlfriend dumps him for being bad in bed,1171,agree
hoax report claims texas turkeys infected with ebola,1035,agree
christian bale wo play steve jobs,1217,discuss
tropical spider under man skin through scar video report,1864,discuss
chugging eggnog at office party lands man in hospital,658,agree
magic mushroom found growing at buckingham palace,957,agree
christian bale in talks to play steve jobs exclusive,591,discuss
absent from duty for 25 years cpwd official dismissed,2134,agree
newly discovered mass grave linked to missing mexican students,443,discuss
do all settings in ios 8 unless you want to lose your icloud files,2423,agree
isis reportedly beheads american photojournalist in iraq,1747,discuss
a soldier has been shot at canada war memorial just steps away from the nation parliament,1457,discuss
banksy arrest hoax us website claims street artist caught in watford,949,agree
nun gives birth to surprise baby after complaining of stomach pains,1412,agree
brian williams no our meteorologist was not peeing on live tv,2511,discuss
wsj apple cut watch health features due to erratic sensors,1917,discuss
nigeria claims deal with boko haram on ceasefire kidnapped girls,1821,discuss
jihadi john as british man from west london,1780,discuss
expert casts doubt on bunbury man dylan thomas burrowing story,1502,disagree
us drones hunting for isis leader seen flying over syrian airspace,1657,discuss
did a meteorite impact in nicaragua over the weekend,2154,discuss
dera sacha sauda chief forced castration of 400 devotees cbi files case against the messenger of god actor,2265,discuss
boko haram denies truce says kidnapped girls married,2463,discuss
breaking isis beheads american journalist james wright foley,1744,discuss
isis executioner john named by media,1219,discuss
is kim really opening a restaurant in scotland,1222,discuss
alleged ottawa gunman what we know so far about michael,1569,discuss
islamic state training pilots to fly mig fighter planes says monitoring group,2408,discuss
hbo in talks with apple to be launch partner for coming web service now,1534,discuss
app brush list actually do so sister you tired it,1784,discuss
rats are still running around at vogue,2263,agree
nigeria says it has deal with boko haram to release kidnapped girls,520,discuss
boko haram doubts after attacks reported in nigeria,1195,discuss
hoax report claims texas turkeys infected with ebola,1335,disagree
hope fades for girls release after boko haram breached,1761,discuss
rapper identified as james foley executioner reports,472,discuss
google said to buy six silicon valley buildings for 585 million,2442,discuss
iraqi health official ebola has killed 5 isis fighters,846,discuss
it back the incredible new batmobile takes a spin around detroit after rumors it had been stolen,2135,discuss
alleged audio of michael brown shooting has surfaced,2118,discuss
texas truck winds up in syria with islamic militants,2379,agree
that boko haram ceasefire in nigeria is a ceasefire,2356,discuss
michael phelps girlfriend says she was born a boy and reveals sex with olympian,862,agree
a bunch of folks are passing around this hoax video of a bird pooping on vladimir putin,1957,agree
what we know about kim yo jong who may control north korea,1152,discuss
video messaging app says audio recording of michael brown shooting is authentic,1818,agree
cook said to confirm apple watch is showerproof lasts a day,1289,discuss
nigeria boko haram blamed for raids despite truce claim,1540,discuss
new audio recording from ferguson may capture michael brown shooting,1379,discuss
boko haram denies nigeria claim,1630,agree
armed drones spotted flying over syria in possible hunt for isis leader,1740,agree
do worry breakfast club star judd nelson is not dead,2286,agree
north korea leader kim jong un is still in charge source,2230,discuss
vigilantes cut off alleged rapist penis,1022,agree
detroit police issue statement that the batmobile is safe,2519,agree
islamic state militants claim to have beheaded us journalist james wright foley,1721,discuss
man chops off own penis throws it in a dustbin after poor show in bed,1799,agree
officials shoot down congressman claims isis terrorists are running across border,2249,agree
vice shane smith drops on vegas dinner,1268,agree
dog found abandoned outside railway station with suitcase of his belongings,1000,agree
video islamic state claims to have captured us weapons airdrop near kobane,2509,discuss
hostage luke somers killed during yemen rescue bid family,1119,discuss
jordan king cites clint eastwood in revenge vow,1787,disagree
in moscow police are looking for a felon cut the male genitals,342,discuss
god is a woman resurrected father narated,1055,agree
made it farther in white house than secret service let on,1365,agree
islamic state in video titled a message to america beheads american journalist james wright foley who was kidnapped in 2012,1744,discuss
banksy arrest hoax us website claims street artist caught in watford,1301,agree
who says reports of suspected ebola cases in iraq are untrue,1778,agree
audio captured at time of michael brown shooting company says,2317,discuss
breaking isis uses chemical weapons murders 300 iraqi soldiers in chlorine gas attack,500,discuss
there has been a shooting at the war memorial on parliament hill unconfirmed reports say a soldier was shot,2410,discuss
people on twitter think macklemore has joined isis,1413,discuss
giant 8ft 9in catfish weighing 19 stone caught in italy is thought to be the biggest ever reeled in with a rod and line,1652,agree
hairgate trends on social media iphone 6 users complain of ripped out hair,1533,discuss
jihadi john as british man from west london,2165,discuss
teacher sex tape exposed as a fake after internet detectives trace the origin of pornographic clip,795,agree
ios 8 bug could delete your icloud drive documents,2423,agree
macaulay culkin dead hoax goes viral claims actor found dead in apartment,1805,agree
bigfoot strolls through a russian forest at least that the claim video,2256,discuss
boko haram could release kidnapped girls nigerian officials say,1761,discuss
isis beheads american james wright foley threatens more to come,1966,agree
italian catches huge wels catfish is it a record,1338,agree
isil beheads american photojournalist in iraq,933,discuss
soldier gunman killed in shooting incident near canadian parliament,1457,discuss
behind top apps in app store,1132,discuss
small meteorite strikes in nicaragua capital city of managua,173,agree
magneto boy living magnet after getting massive electric shock from street lamp,497,agree
lynch mob use butcher meat cleaver to castrate rapist they caught attacking teenage girl in alleyway in indian city,1709,discuss
meteorite leaves crater in nicaraguan capital managua,1073,discuss
woman detained in lebanon is not wife iraq says,1192,discuss
soldier shot near canadian parliament building,1437,discuss
the iphone 6 is not a thing,1308,discuss
islamic state militants claim to have beheaded us journalist james wright foley,1011,discuss
no a mechanical polar bear is not about to be given an asbo,2290,agree
michael brown shooting audio caught on tape,693,discuss
big bank hank us rapper and sugarhill gang founder member dies at 57,1831,agree
two gop congressmen say suspected terrorists caught crossing border,1946,discuss
report missing libyan jetliners raise fears of suicide airliner attacks on,2208,discuss
in moscow police are looking for a felon cut the male genitals,137,agree
managua explosion not a meteorite nasa suggests,1622,discuss
media reports identify londoner as islamic state john,997,discuss
batmobile stolen from batman v superman dawn of justice set zack snyder knows who did it,1177,discuss
video purports to show beheading of journalist by militants,1093,discuss
dhs rebuffs congressman claim isis infiltrating southern border,2367,disagree
despite ceasefire announcement new boko haram attacks reported,2463,discuss
watch us marine saved by helmet after being shot by taliban sniper,115,agree
new audio allegedly captures moment michael brown was shot,2317,discuss
vice media chief said to pay for dinner for 30,1077,discuss
christian bale set to play steve jobs in forthcoming biopic of apple,458,agree
meteorite strike in nicaragua puzzles experts,1213,disagree
boyfriend cuts off his penis and throws it in the bin after girlfriend dumps him for being bad in bed,1410,agree
resetting ios 8 preferences may wipe icloud files,2054,discuss
is ebola virus spreading among isis militants reports claim jihadists seeking cure at mosul hospital,2025,discuss
insurgents killed in nigeria despite alleged truce with boko haram,1588,discuss
kim broke both ankles and is hospitalized report claims,1972,discuss
spider burrows into australian man appendix scar video,1923,disagree
breaking isis beheads american journalist james wright foley,1288,discuss
former soldier says is used chemical weapons in kobani,964,discuss
nbc weatherman caught urinating in the woods live on air,984,discuss
isis militants appear to behead abducted american journalist james wright foley in graphic video,1580,discuss
small red book among finds in boston time capsule,2288,agree
country music legend willie nelson dies at age 81,1869,agree
report hbo now coming to apple tv next month,815,discuss
nigeria hopes for return of kidnapped schoolgirls rise after ceasefire reported,600,discuss
popular instagram account offers powerful message of perseverance after paris attack,2375,discuss
from bendgate to hairgate now iphone 6 users complain the device is ripping out their hair,1867,discuss
iraqi media isis militants have contracted ebola,2180,discuss
soldier shot near canadian parliament building,2410,discuss
senior western intelligence official confirms london rapper abdel majed abdel bary is a suspect in the foley killing,951,discuss
gateway pundit,1202,discuss
audio captured at time of michael brown shooting company says,1818,agree
update internet report of ebola outbreak in purdon not true,1625,agree
isil beheads american photojournalist in iraq,903,discuss
video messaging service verifies timing of cnn audio recording,1446,discuss
isis appears to behead american photojournalist in youtube video,1580,discuss
the arrest of the isis leader wife and son,703,disagree
isis leader killed abu bakr reportedly killed by airstrike,1634,discuss
james foley beheading london rapper turned jihadist believed to be under investigation for murder of journalist in syria,1036,discuss
six months after abducting nigerian schoolgirls boko haram reportedly wants to free them,1821,discuss
detroit police issue statement that the batmobile is safe,1459,discuss
dog abandoned at scottish rail station with suitcase full of belongings read more http ixzz3o9shc1io,1853,agree
john the islamic state killer behind the mask is a young londoner,882,agree
who investigates media reports isis fighters contracted ebola,1904,discuss
gill rosenberg canadian citizen reportedly captured by isis in syria,1330,discuss
michael phelps reveals she was born a man and never told the swimmer,1349,agree
isis beheads photojournalist james wright foley in a massage to us to end its intervention in iraq,1011,discuss
axl rose not dead fake msnbc death hoax goes viral on facebook,2166,agree
big bank hank of the sugarhill gang has died,2398,agree
batmobile stolen in detroit good one joker,1529,discuss
cnn plays alleged recording of michael brown shooting,1818,discuss
small meteorite strikes nicaragua government says,2475,discuss
hairgate trends on social media iphone 6 users complain of ripped out hair,2088,discuss
pentagon denies it killed isis chief as airstrikes hit top extremists,723,discuss
islamic militants post video claiming to show beheading of journalist,694,discuss
bombing had signed my death certificate missing us journalist james wright foley goes unflinching to his death as isis behead him in horrific video as a warning to obama,1011,discuss
we took a look at the photo said to show the body of islamic state leader abu bakr right and found it was really an ethnic albanian militant killed in 2013,723,discuss
pictured libyan islamist rebels pose with planes seized from tripoli airport as officials warn they could be used to carry out terrorist attack on anniversary,2162,discuss
of slain is leader reported to be doctored,1466,discuss
chinese parents try to sell their son to pay for medical treatment for his sick twin sister,1627,agree
apple was forced to nix key health features from its smartwatch report,1917,discuss
someone painted a graffiti dick on a million car,948,disagree
explosion reported near the nicaraguan capital attributed to meteorite impact but experts including nasa cast doubt on claims,1661,discuss
nigeria hopes for return of kidnapped schoolgirls rise after ceasefire reported,1540,discuss
watch us marine saved by helmet after being shot by taliban sniper,2267,agree
batmobile stolen in detroit good one joker,1459,discuss
boko haram denies truce says kidnapped girls have been,1896,discuss
rapper is main suspect in search for isis jihadist who beheaded james foley,1530,discuss
british hostage david haines beheaded by islamic state terrorists,2206,agree
white house fence jumper got farther than previously thought sources say,1840,discuss
islamic state in video titled a message to america beheads american journalist james wright foley who was kidnapped in 2012,1580,agree
us lawmaker ten isis fighters have been apprehended coming across southern border video,2249,discuss
report audio reveals pause between gunshots when michael brown was shot,1916,discuss
meteorite strikes nicaraguan capital creates crater,1790,discuss
texas plumber baffled after truck ends up in the hands of syrian rebels,2280,discuss
isil video claims beheading of kidnapped journalist james foley,1016,discuss
fidel castro rumors sweep internet but no sign in cuba,1401,discuss
ebola outbreak 2015 update isis fighters may have contracted deadly virus,1778,discuss
christian bale set to play steve jobs in forthcoming biopic of apple,945,agree
meteorite mysterious boom in nicaragua,1661,discuss
apple watch specs tipped said to feature 512mb ram 4gb of storage,126,discuss
bombing had signed my death certificate missing us journalist james wright foley goes unflinching to his death as isis behead him in horrific video as a warning to obama,2388,discuss
sugarhill gang rapper bank hank dies at 57,1637,agree
sadly pumpkin spice condoms are a thing after all,740,agree
attorney new audio reveals pause in gunfire when michael brown was shot,1379,agree
isis militants allegedly contracted ebola,1615,discuss
audio captured at time of michael brown shooting company says,2287,discuss
seth rogen to play apple steve wozniak,349,discuss
dog abandoned at scotland train station with suitcase,2523,agree
nun who had no idea she was pregnant gives birth after going to hospital with stomach pains,2492,agree
mass grave found after 40 students disappear in mexican protest,1912,discuss
nicaragua meteorite impact theory may be,1622,discuss
nigeria claims deal with boko haram on ceasefire kidnapped girls,1166,discuss
customer i was fired for comcast complaint,2438,discuss
updated saudi state television allegedly blurs michelle obama face during meeting with new saudi king,913,discuss
cheese blamed for north korean leader kim broken ankles,2153,discuss
what was fake on the internet this week obama peace prize condoms and insane winter snow,2269,agree
cbi registers conspiracy case against dera chief after claims 400 male followers were forcibly castrated,1654,discuss
shots heard in alleged brown shooting recording audio,1817,discuss
after giving a homeless man 100 this guy secretly filmed him,1611,discuss
conde nast rat problem at one world trade centre from red carpets to rodent droppings,224,agree
john the islamic state killer behind the mask is a young londoner,997,discuss
led zeppelin robert plant ripped up a 924 million reunion contract,699,agree
lebanon detains wife and son of,1468,disagree
in new york city marijuana may mean ticket not arrest,2389,discuss
seth rogen may play steve wozniak alongside christian bale as steve jobs,1141,discuss
american hostage in yemen freed in military ministry,1119,discuss
report isis leader abu bakr assassinated in airstrike,731,discuss
canadian soldier shot at ottawa war memorial report,2156,discuss
tom brokaw brian williams out nbc legend at iraq war lie as it claimed executives warned anchor to stop exaggerating the story in the past,1570,discuss
the gold apple watch edition could set you back a whopping,1595,discuss
british man slaps people if they sneeze in public,1155,agree
batman set to play steve jobs in upcoming biopic,1226,disagree
isis video claims to show beheading of british hostage,2306,discuss
kim scottish dog meat restaurant is probably fabricated shite,2418,discuss
cnn airs alleged audio from michael brown shooting,1817,discuss
james foley beheading london rapper turned jihadist believed to be under investigation for murder of journalist in syria,405,discuss
kc hospital patient does not have symptom profile of ebola,2127,agree
arms airdrop fell into isis hands pentagon,2200,discuss
new york schoolboy who made 72million trading stocks on his lunch breaks and now takes his friends out to dine on 400 caviar drives a bmw and has definitely made his immigrant parents proud,1184,agree
a bogus banksy,1532,agree
priest who died for 48 minutes says he met god and she a woman,603,agree
obama administration denies congressman claim that least ten isis fighters have been caught coming across the mexican border in texas,855,agree
was viral video of generous homeless man all a hoax,2132,agree
nigeria says it struck a with boko haram but are they talking to the right guy,1419,discuss
cnn airs alleged audio from michael brown shooting,1564,discuss
rose dead guns n roses frontman killed by internet death hoax,292,agree
iraqi and kurdish media reports isis fighters have contracted ebola,938,discuss
woman detained in lebanon is not wife iraq says,1468,agree
rcmp release security footage of michael zehaf bibeau during attack say he shot soldier in back,1442,discuss
boko haram denies ceasefire claim by nigeria government,1885,agree
bali spider burrows under aussie chest,476,agree
see how this homeless man spends a hundred dollars and keep a tissue handy video,738,agree
missing american journalist reportedly beheaded by islamic state,933,discuss
met police denies reports of banksy arrest,1884,agree
isil beheads american photojournalist in iraq,632,discuss
customer i was fired for comcast complaint,2238,discuss
this kid made 72 million during lunch,1781,discuss
banksy real identity revealed is the same hoax from last year,1301,agree
macaulay culkin dead actor once again victim of death hoax,1805,agree
kim surgery on fractured ankles,1972,discuss
an audio recording of the michael brown shooting has reportedly surfaced,1916,discuss
durex is not confirming or denying rumors of a condom,1985,discuss
report nigerian woman quarantined in kc with symptoms video,1404,discuss
unverified video shows beheading of aid worker david haines,2206,discuss
homeland security says terrorists have crossed border,2367,disagree
could kim jong un open a restaurant in scotland,2452,discuss
does vogue new office have a rat infestation,2263,discuss
net extra catholic priest claims god is a female,808,agree
iraqi and kurdish media reports isis fighters have contracted ebola,2138,discuss
islamic state leader family detained by lebanon officials say,703,discuss
north korean leader kim jong un had ankle surgery report says,1972,discuss
audio recording allegedly captures at least 10 shots fired in michael brown killing,2481,discuss
iraqi health official ebola has killed 5 isis fighters,2075,discuss
god is a woman resurrected father narated,2515,agree
breaking news isis beheads missing american journalist james wright foley as warning to us to cease action in iraq,1471,agree
isis blasts bombs at civilian areas in iraq mosul residents living in fear,1474,agree
seven girls fall pregnant after five day school trip in bosnia and herzegovina,2504,agree
insurgents killed in nigeria despite alleged truce with boko haram,1630,discuss
us confirms death of somalia terror group leader,839,agree
first bendgate now it hairgate angry iphone 6 owners claim design is causing chunks of their hair to be ripped out when they make a phone call,2476,discuss
did josh paler lin stage his viral video about helping the homeless,2061,disagree
gill rosenberg former idf soldier possibly captured by isis while fighting with kurds,1330,discuss
pure evil islamic state beheads american journalist james wright foley,2388,discuss
christian bale in talks to play steve jobs in danny boyle biopic,2343,discuss
angry mob hacks off alleged rapist genitals with meat cleaver after dragging him into butchers,1476,discuss
north korea reportedly bans anyone sharing kim jong un name,1857,discuss
isil beheads american photojournalist in iraq,1744,discuss
here video of a bird pooping on vladimir putin in the middle of a speech,1813,disagree
video purports to show beheading of journalist by militants,847,discuss
guru who ordered 400 followers to be castrated they could be closer to god is investigated for grievous bodily harm in india,1909,discuss
this powerful cartoon about the charlie hebdo attack is not by banksy,2375,agree
ypg confirms gill rosenberg not captured in kobani,1862,disagree
british aid worker david haines beheaded by isil,2102,agree
james foley missing american photojournalist reportedly executed by isis in syria,903,discuss
got farther into white house,1488,discuss
another isis massacre isis kills 300 iraqi soldiers with chlorine gas,2224,discuss
bodies in mexico mass grave apparently not those of missing students,1912,discuss
isis fighters seize weapons airdrop meant for kurds,1076,discuss
nigeria hopes for return of kidnapped schoolgirls rise after ceasefire reported,1681,discuss
will stop serving overweight customers,1848,disagree
alleged audio of michael brown shooting released,2481,discuss
dead for 48 minutes catholic priest claims god is female,2445,disagree
woman reportedly kidnapped by isis jerusalem post,1862,discuss
boyfriend cuts off his penis and throws it in the bin after girlfriend dumps him for being bad in bed,1560,discuss
jinny abdel bary uk rapper suspected in james foley killing reports,1202,discuss
hoax arrested in london story dupes the internet again,2051,agree
nigeria claims boko haram will release the kidnapped schoolgirls,2463,discuss
new york schoolboy who made 72million trading stocks on his lunch breaks and now takes his friends out to dine on 400 caviar drives a bmw and has definitely made his immigrant parents proud,2407,disagree
isis militants have contracted ebola iraqi kurdish media reports,1669,discuss
cameron vows to hunt down is after haines murder,588,agree
man chops off his own penis after girlfriend told him he was no good in bed,1560,discuss
audio recording allegedly captures at least 10 shots fired in michael brown killing,1009,discuss
nun surprise baby after complaining of stomach pains,1412,discuss
sources guns n roses frontman axl rose found dead in west hollywood home at age 52,292,discuss
unconfirmed reports claim gill rosenberg captured by isis,1893,discuss
islamic state militants claim to have beheaded us journalist james wright foley,1288,discuss
taliban member swapped by obama for bowe bergdahl tried to return to terror report,2531,discuss
who says reports of suspected ebola cases in iraq are untrue,1669,discuss
boko haram denies it has agreed ceasefire,2530,discuss
report possible audio tape of michael brown shooting,2345,discuss
ate through the ceilings and pooped on the keyboards rats are over vogue new world trade center office and anna wintour longer wants to work there,2072,discuss
vogue new digs are reportedly swarming with rats,2064,discuss
cpwd official sacked for absence from duty for 25 years,1318,agree
the image that everyone is sharing by is by banksy but it awesome,2024,agree
has north korean dictator kim been replaced by his sister,2470,discuss
us intel taliban man released from gitmo in bergdahl deal is back to militant activity,2207,discuss
james foley american journalist james wright foley beheaded in new isis video breaking news,1336,agree
man known as john is identified as mohammed emwazi,2123,discuss
batmobile stolen in detroit good one joker,266,discuss
isis militants appear to behead abducted american journalist james wright foley in graphic video,2524,discuss
indian civil servant sacked sickie,1318,agree
cnn airs alleged audio from michael brown shooting,2434,discuss
kim surgery on fractured ankles,859,discuss
soldier shot in ottawa at war memorial,1659,discuss
bali spider burrows under aussie chest,1502,agree
saudi cleric says snowmen are,1064,agree
attorney new audio reveals pause in gunfire when michael brown was shot,1818,agree
see it california homeless man uses 100 gift to give food to others,2132,disagree
isil video claims beheading of kidnapped journalist james foley,1580,discuss
an audio recording of the michael brown shooting has reportedly surfaced,2317,discuss
michael phelps girlfriend says she was born a boy and reveals sex with olympian,1847,agree
nigeria says ceasefire agreed with boko haram,2191,discuss
missing mexican students found in mass grave,1984,agree
mexico student massacre update more graves discovered at murder site,2342,discuss
lynch mob castrates alleged rapist in rajasthan,1981,agree
