rebel leader killed in strike somali government,839,agree
ferguson riots audio may have captured michael brown shooting,1715,discuss
thanks uncle sam we have your weapons airdrop isis taunts america over intercepted weapons meant for kurds,2404,discuss
nigeria says it struck a with boko haram but are they talking to the right guy,531,discuss
banksy real identity revealed is the same hoax from last year,1739,agree
james foley american journalist james wright foley beheaded in new isis video breaking news,2067,agree
tropical spider burrows under man skin through scar,1860,agree
bosnia seven underage girls return from five day school trip pregnant,1667,discuss
what was fake on the internet this week obama peace prize condoms and insane winter snow,740,agree
pentagon airstrike killed terror leader in somalia,839,agree
the arrest of the isis leader wife and son,1192,discuss
leader who ordered kenya mall massacre believed killed in us drone attack in somalia,427,discuss
dog abandoned at ayr station with belongings in suitcase,618,agree
nigeria claims boko haram will release the kidnapped schoolgirls,1761,discuss
tiger woods is not on suspension for failing a drug test his agent and a pga official say,757,agree
isis supporters claim us hostage killed in coalition air strike in syria,2376,discuss
is kim jong un sister kim yo jong in charge,817,discuss
nigeria boko haram blamed for raids despite truce claim,922,discuss
horror isis fighters have reportedly contracted ebola,1040,discuss
ypg confirms gill rosenberg not captured in kobani,474,agree
seth rogen to star as steve wozniak in sony steve jobs biopic updated,1575,discuss
isis murdered kidnap victim to his own mother after she travelled to their headquarters and demanded to see him,1743,discuss
hope fades for girls release after boko haram breached,1588,agree
this dog was left at a railway station with a suitcase of his belongings after he was sold on gumtree,2523,agree
texas plumber is sure how extremists in syria ended up with his work truck,2242,agree
rare meteorite impact causes blast in nicaragua capital managua,1068,discuss
michael brown shooting audio caught on tape,1379,discuss
boko haram claims to have german hostage denies ceasefire,1896,discuss
popular instagram account offers powerful message of perseverance after paris attack,2070,discuss
jordanian airstrike killed american aid worker held hostage by isis according to statement by militants,1337,discuss
airstrike kills islamic al shabab terrorist leader in somalia,1306,agree
video marine survives taliban sniper headshot thanks to helmet,1481,agree
alleged audio of michael brown shooting released,1605,discuss
boko haram denies nigeria claim,2144,discuss
report isis kidnaps former idf soldier who went to fight with the kurds,2471,discuss
how canadian kevin vickers killed shooter in parliament,1900,agree
mexico checks if 43 missing students in mass grave,1109,discuss
ios 8 bug reportedly erases icloud drive documents when settings are reset,545,discuss
confirms earth will experience 6 days of total darkness in december fake news story goes viral,2521,agree
media reports identify londoner as islamic state john,1219,discuss
jeh johnson shoots down duncan hunter assertion is is entering via mexico,2016,agree
chugging eggnog sends utah man to hospital,741,agree
christian bale wo play steve jobs,1215,disagree
awesome canadian parliament kevin vickers takes out gunman,1666,agree
nelson dead guitarist killed by internet death hoax,2186,agree
nigeria announces truce with boko haram fate of schoolgirls unclear,1896,discuss
boko haram denies nigeria claim,2272,agree
search launched for dog owner after pooch found dumped next to suitcase filled with belongings,2483,agree
is the alleged audio of the gunshots that killed michael brown a hoax,2149,discuss
batman superman batmobile stolen,2519,discuss
apple was forced to nix key health features from its smartwatch report,521,discuss
unconfirmed reports claim gill rosenberg captured by isis,1899,discuss
alleged audio of michael brown shooting released,1916,discuss
predator drone reportedly spotted over isis stronghold,2469,discuss
someone painted a graffiti dick on a million car,124,agree
small meteorite strikes nicaragua government says,1913,discuss
apple on macbook air,2039,discuss
islamist militants 11 commercial planes in libya sparking terror attack fears,1958,discuss
after giving a homeless man 100 this guy secretly filmed him,1020,agree
video purports to show beheading of journalist by militants,2388,discuss
lady on fb i 41 intersex and fucked michael phelps on first date,23,discuss
isis getting ebola,2138,disagree
nigeria says ceasefire agreed with boko haram,837,discuss
report nearly a dozen commercial airliners missing ahead of anniversary after islamists overrun libyan airport,1165,discuss
spec leak suggests apple watch will be on par with android wear rivals,1585,discuss
comcast declares war on tor,569,discuss
isis beheads photojournalist james wright foley in a massage to us to end its intervention in iraq,368,agree
leader who ordered kenya mall massacre believed killed in us drone attack in somalia,839,discuss
rare meteorite impact causes blast in nicaragua capital managua,966,agree
nigeria says it struck a with boko haram but are they talking to the right guy,2191,discuss
rumor stainless steel apple watch will cost 500 gold,1983,discuss
islamic state accused of using chlorine gas on iraqi soldiers,2224,discuss
in kim jong un absence his sister may rule or not,2313,discuss
isis getting ebola,1778,disagree
pictured heroic 58 walking through parliament gun in hand just moments after he killed gunman michael,2113,discuss
video messaging service verifies timing of cnn audio recording,1379,agree
isis video america air dropped weapons now in our hands,1597,discuss
seth rogen reported to play woz in the upcoming steve jobs movie,1262,discuss
meteorite strike in nicaragua puzzles experts,1722,discuss
wtc rats scare off anna wintour,1149,discuss
sugarhill gang big bank hank dead at 57,2080,agree
tropical spider burrows under man skin lives there for three days,1883,agree
batmobile not stolen mtv contest prize remains unclaimed,1671,discuss
6 islamist militants killed in us attack in somalia,2374,discuss
iphone hit by new social media storm,1867,discuss
no there are any ebola cases in iraq,620,agree
cnn plays alleged recording of michael brown shooting,1715,discuss
apple next macbook could be a macbook air,2497,discuss
is kim sister now the power behind the north korean throne,1836,discuss
misinformation brian williams explains the mike seidel liveshot,1829,disagree
so there might be a rat infestation at vogue,2106,discuss
identity of isis terrorist known as john reportedly revealed,1780,discuss
former porn star behind youtube sensation toy collector makes 5 million per year unboxing disney toys,1315,agree
no saudi tv did blur out michelle obama face when the president met king salman,833,discuss
new york schoolboy who made 72million trading stocks on his lunch breaks and now takes his friends out to dine on 400 caviar drives a bmw and has definitely made his immigrant parents proud,1858,disagree
confirms earth will experience 6 days of total darkness in december fake news story goes viral,506,agree
nun who gave birth to baby boy after suffering agonising stomach pains no idea she was pregnant,899,agree
nicaragua meteorite impact theory may be,1249,discuss
ebola outbreak 2015 update isis fighters may have contracted deadly virus,542,discuss
that was fast christian bale bails on steve jobs biopic,2455,discuss
sugarhill gang rapper big bank hank dies at age 57,2080,agree
us officials video shows american execution,2096,discuss
islamic state claims to have beheaded american journalist,1288,discuss
hbo streaming service could launch in april for 15 per month work on apple tv,727,discuss
woman detained in lebanon is not wife iraq says,931,discuss
led zeppelin reunion robert plant rips up 300 million contract refuses to rejoin legendary band,2489,discuss
moment marine is saved by his kevlar helmet as taliban sniper bullet hits him in head,2360,agree
nigeria says ceasefire agreed with boko haram,1166,discuss
predator drone reportedly spotted over isis stronghold,1657,discuss
is kim jong un sister kim yo jong in charge,689,discuss
spurned wife leaves cheating husband and twin naked in busy car park,1852,agree
report christian bale just bailed on the steve jobs movie,755,agree
big bank hank dead sugarhill gang member and rapper dies aged 57,2351,agree
has ebola infected isis militants in mosul,1891,discuss
rats at vogue nyc offices watch your step anna wintour,1543,discuss
seth rogen to play steve wozniak in steve jobs biopic,712,discuss
quarter pounder looks about the same,559,discuss
mirfield man tears of joy after lost voicemail of wife retrieved,1640,agree
a message from jim mom diane foley,2450,agree
is the alleged audio of the gunshots that killed michael brown a hoax,1692,discuss
the apple watch has a mode that only tells the time,2124,discuss
small meteorite strikes nicaragua government says,885,discuss
isis claims an american hostage kayla mueller died in airstrike in syria,2376,discuss
isis leader in us airstrikes,1254,discuss
islamic state may have fighter jets now after seizing migs,950,discuss
yes you can wear your apple watch in the shower,2472,discuss
cnn expert on brown audio at first i thought trying to punk cnn,1776,agree
who says reports of suspected ebola cases in iraq are untrue,1506,discuss
isil allegedly kills us journalist in video,2386,discuss
hairgate trends on social media iphone 6 users complain of ripped out hair,2476,discuss
nigeria says it struck a with boko haram but are they talking to the right guy,308,discuss
an audio recording of the michael brown shooting has reportedly surfaced,2250,discuss
continuing violence puts boko haram ceasefire in jeopardy,1340,discuss
dera sacha sauda chief forced castration of 400 devotees cbi files case against the messenger of god actor,1654,discuss
islamic militants post video claiming to show beheading of journalist,2147,discuss
boogie developer leaves secret resignation letter to boss at the end of the game video,2458,agree
elderly woman arrested for kidnapping neighbor cats making fur coats,529,agree
heartwarming video shows son revealing he paid off parent mortgage as a christmas gift,888,agree
boko haram denies truce to release kidnapped schoolgirls,2139,agree
new rumour suggests apple watch to launch in february,2401,discuss
thanks uncle sam we have your weapons airdrop isis taunts america over intercepted weapons meant for kurds,2295,discuss
says she aborted baby because it was a boy,1494,agree
7 teen girls get pregnant on school trip read more at http,2125,disagree
isis video america air dropped weapons now in our hands,2172,discuss
what was fake on the internet this week obama peace prize condoms and insane winter snow,1060,discuss
comcast turns complaints back on customer gets his employer to fire him,2438,discuss
caught a catfish record in po 127 kg and meters,1338,agree
turkish president says american weapons drop for kurdish fighters was after supplies end up in the hands of isis,781,agree
china satirical site warns citizens over name choices,1660,disagree
amazon reportedly planning an video service that will be cheaper than netflix,1048,discuss
new york city plans to end arrests for possession of small amounts of marijuana,2389,discuss
isis claims it has us airdrop of weapons,1485,discuss
christian bale wo play steve jobs after all,1841,agree
watch isis claims to have captured airdropped weapons,1361,discuss
boko haram denies nigeria claim,2356,discuss
missing american journalist reportedly beheaded by islamic state,1580,discuss
bombing had signed my death certificate missing us journalist james wright foley goes unflinching to his death as isis behead him in horrific video as a warning to obama,2096,discuss
josh paler lin gives a homeless man 100 and follows him to see how he spends it,1388,discuss
that story about a catholic priest dying seeing god as a woman and coming back to life it almost definitely fake,2515,disagree
lynch mob castrates alleged rapist in rajasthan,214,discuss
cnn plays chilling audio recording allegedly from michael brown shooting least 11,1605,discuss
isis beheading of journalist james foley posted to youtube,1747,agree
founding time capsule found in boston,1997,discuss
audio recording allegedly captures moment michael brown was shot,2220,discuss
banksy real identity revealed is the same hoax from last year,2468,agree
christian bale wo play steve jobs after all,1299,agree
cnn plays alleged recording of michael brown shooting,2287,discuss
isis claims it has us airdrop of weapons,2397,discuss
islamic state may have fighter jets now after seizing migs,1606,discuss
a message from jim mom diane foley,2047,discuss
video shows isil beheading of photojournalist james foley,1016,agree
report of kim ankle injury add fuel to rumours about his absence,2153,discuss
kim to open a new restaurant in scotland,1222,discuss
fears journalist james wright foley beheaded by islamic state jihadists in to united states,1580,discuss
tropical spider burrows under man skin lives there for three days,1860,agree
sugarhill gang rapper big bank hank dies at age 57,1556,discuss
report jetliners stolen from libya could be used to attack on,1197,discuss
apple watch pricing will you spend 5000 for gold edition 500 for stainless steel,577,discuss
north korean leader kim mystery illness actually two broken ankles newspaper says,856,discuss
report jetliners stolen from libya could be used to attack on,1958,discuss
amazon to launch first store report says,2116,discuss
homeless man who became a youtube sensation after spending 100 on food for his beggar friends gets a surprise christmas meal makeover and night in a hotel in new video but is it all a hoax by a prankster,1388,discuss
boko haram agrees to ceasefire release of school girls,2272,disagree
meteorite strikes nicaraguan capital creates crater,1068,discuss
alleged audio of michael brown shooting released,721,discuss
insurgents killed in nigeria despite alleged truce with boko haram,955,discuss
sugarhill gang rapper bank hank dies at 57,1556,discuss
we took a look at the photo said to show the body of islamic state leader abu bakr right and found it was really an ethnic albanian militant killed in 2013,1889,discuss
senior western intelligence official confirms london rapper abdel majed abdel bary is a suspect in the foley killing,472,discuss
video shows isil beheading of photojournalist james foley,1658,agree
feminist aborts baby for being a boy shocked people do approve,2014,disagree
apple macbook air details emerge device could be thinner lighter than current model,690,discuss
us drones hunt isis leader in syria,2469,discuss
michael phelps 41 reveals she was born a male as she describes her intimacy with olympic swimmer,1847,agree
for sale tiger former island in sweden,1991,agree
force awakens release date jj abrams plan for an early release of wars movie,1269,discuss
so there might be a rat infestation at vogue,2031,discuss
islamist militants 11 commercial planes in libya sparking terror attack fears,920,discuss
watch marine take sniper shot to the head and live,488,agree
lynch mob chop man penis off after catching him allegedly trying to rape teenager,2005,agree
here video of a bird pooping on vladimir putin in the middle of a speech,2174,agree
christian bale wo play steve jobs,591,agree
you may be able to make appointments at the apple store to try on the apple watch when it launches,2056,discuss
spider burrowed through tourist stomach and up into his chest,1860,agree
pure evil islamic state beheads american journalist james wright foley,1471,agree
is the alleged audio of the gunshots that killed michael brown a hoax,2434,discuss
resetting ios 8 preferences may wipe icloud files,1518,discuss
michael phelps girlfriend taylor lianne chandler reveals she was raised as a boy,1349,agree
batmobile was stolen cops,2519,agree
nicaragua says meteorite probable cause of blast in capital,2264,discuss
nujaifi condemns daash crime in saqlawiyah and alsiger areas of anbar,2002,discuss
isis video america air dropped weapons now in our hands,1120,discuss
bali spider burrows under aussie chest,1579,discuss
pentagon isis got weapons package,1010,discuss
hairgate iphone 6 users say device pulls out hair,1308,discuss
reports isis fighters have contracted ebola are says iraqi health ministry,1669,discuss
reports jihadists steal commercial jets raise fears,2162,discuss
after giving a homeless man 100 this guy secretly filmed him,1922,discuss
james wright foley kidnapped journalist apparently executed by isis,880,discuss
islamic state releases video apparently showing the beheading of missing us journalist james foley,1206,discuss
see it isis militants caught trying to cross border into texas congressman claims,1931,discuss
isis chlorine attack on security forces confirmed iraq officials,2002,discuss
mps credit for saving lives in parliament hill shootings,484,discuss
nigeria announces truce with boko haram fate of schoolgirls unclear,1430,discuss
dog found abandoned outside railway station with suitcase of his belongings,1544,agree
weatherman caught peeing live on camera,1968,disagree
this letter to parents from a 1970s lego set contains an important message for gender equality,1547,agree
isis claims us hostage kayla mueller killed in coalition airstrike,1881,discuss
pentagon denies it killed isis chief as airstrikes hit top extremists,254,agree
small meteorite hits managua,2154,discuss
lady on fb i 41 intersex and fucked michael phelps on first date,1342,discuss
batmobile not stolen mtv contest prize remains unclaimed,917,agree
terror leader ahmed abdi godane killed in strike,2364,discuss
graffiti artist banksy arrested in london identity revealed,1739,disagree
apple watch users will need to recharge nightly company still working to improve uptime before launch,708,discuss
macaulay culkin dead actor once again victim of death hoax,1545,agree
christian bale to play steve jobs in upcoming biopic,1841,disagree
british aid worker david haines beheaded by isil,2241,discuss
senator detainees swapped for bergdahl have contacted militants,1628,discuss
canada probes michael as possible suspect in ottawa shooting source,1970,discuss
militant group says it killed american journalist in syria,1580,discuss
categorically false dhs debunks fiction that isis attempted to cross the mexico border,2266,discuss
tropical spider burrows under man skin lives there for three days,2338,discuss
pentagon somali terror group leader killed in airstrike,1982,discuss
teacher sex tape exposed as a fake after internet detectives trace the origin of pornographic clip,482,agree
tropical spider burrowed under man skin through appendix scar and lived there for three days,1104,agree
sugarhill gang rapper bank hank dies at 57,993,agree
hbo reportedly in talks with apple for launch of new unbundled streaming service,1534,discuss
research medical center denies reports that a patient has ebola,1015,agree
leader of somali group is dead says,1306,discuss
tropical spider burrowed under man skin through appendix scar and lived there for three days,2293,discuss
jeh johnson politicians should the flames of fear over isis ebola,1764,agree
big bank hank of the sugarhill gang is dead at 57,2340,discuss
iraq denies lebanon captured abu bakr wife and child,2337,agree
christian bale will not play steve jobs,729,agree
this man paid off his parents mortgage for christmas video,1599,discuss
stopped shooter on parliament hill,1356,discuss
breaking hostage in failed rescue attempt,826,discuss
stainless steel apple watch could cost just 499 but gold will be 10 times as pricey,2277,discuss
jilted lover chops off his penis after girlfriend dumps him,522,discuss
batmobile stolen from v superman dawn of justice set report claims that one of the batmobile models is missing detroit locals responsible,1237,discuss
what glenn beck fears may be done with the 11 missing jets,2162,discuss
in vogue vs rats war the rats are winning,1543,discuss
caught a catfish record in po 127 kg and meters,1652,agree
shots heard in alleged brown shooting recording audio,1715,discuss
280 pound catfish fisherman makes huge catch in italy catfish could set record,842,agree
jinny abdel bary uk rapper suspected in james foley killing reports,2528,discuss
isil allegedly kills us journalist in video,2388,discuss
isis appears to behead american photojournalist in youtube video,2524,discuss
cold turkey,1597,agree
video messaging service verifies timing of cnn audio recording,1817,discuss
batmobile stolen from batman v superman dawn of justice set zack snyder knows who did it,942,discuss
texas city plumber truck ends up in syrian war,2379,agree
meteor leaves crater near managua airport,767,disagree
continuing violence puts boko haram ceasefire in jeopardy,1896,discuss
n korean leader misses annual ritual sister over duties,744,discuss
shock claim pga golfer says tiger woods is suspended for failed drug test,757,discuss
ottawa investigates reports that isis has captured woman,1106,discuss
michael phelps reveals she was born a man and never told the swimmer,1847,agree
marijuana law new york how policy could make things worse for minor offenders,2389,discuss
man chops off own penis after being dumped by his girlfriend,1434,discuss
macaulay culkin dead another death hoax circulates on facebook,804,agree
report christian bale drops out of steve jobs biopic,2455,discuss
angry mob cut off rapist penis with meat cleaver viewer discretion,650,agree
kim surgery on fractured ankles,1854,discuss
isis reportedly beheads american photojournalist in iraq,1580,discuss
isis claims it has us airdrop of weapons,1253,discuss
is this proof of bigfoot new video shows giant hairy beast walking through forest,2256,discuss
continuing violence puts boko haram ceasefire in jeopardy,1139,discuss
gcpd solved stolen batmobile case,1529,discuss
evander kane on way out from source price is very high who is in,1169,discuss
wife and son of isil leader abu bakr at lebanon border,1267,discuss
guantanamo detainee exchanged for american pow attempts a return to battle,2531,discuss
stainless steel apple watch could cost just 499 but gold will be 10 times as pricey,2365,discuss
who says reports of suspected ebola cases in iraq are untrue,992,agree
hope fades for girls release after boko haram breached,1195,discuss
tiger woods is not on suspension for failing a drug test his agent and a pga official say,2175,discuss
bali spider burrows under aussie chest,1880,disagree
bergdahl senator says jihadists swapped for troop touch with affiliate,2531,discuss
pope says dogs can go to heaven is open to all of god creatures,2370,disagree
lynch mob castrates alleged rapist in rajasthan,1959,agree
report nypd to stop arresting people for minor marijuana offenses,1802,discuss
boko haram denies it has agreed ceasefire,2272,discuss
cnn posts alleged audio of michael brown shooting,2235,discuss
christian bale in talks to play steve jobs in danny boyle biopic,945,discuss
abdel majed abdel bary emerges as suspect in foley beheading,583,discuss
canadian woman by isis in syria says she is actually fine and still fighting the jihadists despite kidnap reports,2302,discuss
meteorite makes big crater in nicaragua government says,1825,discuss
canadian soldier shot at ottawa war memorial report,1071,discuss
aaron sorkin confirms christian bale will play steve jobs,2211,disagree
shots heard in alleged brown shooting recording audio,2235,discuss
isis beheads photojournalist james wright foley in a massage to us to end its intervention in iraq,2495,discuss
audio captured at time of michael brown shooting company says,1009,discuss
nigeria boko haram reach ceasefire deal kidnapped girls to go free official says,1630,discuss
nigerians doubtful of girls release after boko haram breached,1896,discuss
chinese parents try to sell their son to pay for medical treatment for his sick twin sister,1562,agree
govt fires employee who skipped work for 24 years,2441,agree
pumpkin spice condoms do fall for this hoax,1985,discuss
turkish leader says airdrop aided isis militants,1485,agree
rebel leader killed in strike somali government,1306,agree
apple watch smartwatch to ship 15 million units worldwide in 2015,406,discuss
macaulay culkin dead internet death hoax claims actor found dead in apartment,1805,agree
gop rep least ten isis fighters have been caught coming across the mexican border,1185,discuss
tropical spider burrowed under man skin through appendix scar and lived there for three days,1860,agree
lebanon detains wife and son of,670,discuss
missing libyan jetliners raise fears of suicide airliner attacks on,2208,agree
isis claims us hostage kayla mueller killed in coalition airstrike,2387,discuss
mps credit for saving lives in parliament hill shootings,611,discuss
rumor robert plant ripped up 800 million contract to reunite led zeppelin called,2489,discuss
meteor leaves crater near managua airport,2475,disagree
boko haram ceasefire ignored as violence flares in borno state,2356,discuss
in vogue vs rats war the rats are winning,2064,agree
media reports identify londoner as islamic state john,2165,discuss
italian fisherman catches monstrous catfish,2161,agree
islamic state accused of using chlorine gas on iraqi soldiers,969,discuss
islamic militants post video claiming to show beheading of journalist,1016,discuss
boko haram abducted nigerian schoolgirls to be released officials say,2530,discuss
aborted my baby because it was a boy outrage after blogger claims gender prompted termination,1494,agree
islamist websites claim woman kidnapped by is report,1774,discuss
kim had ankle surgery source,1480,discuss
isilkulskom student has gained superhero powers after shock,1433,agree
