rebel leader killed in strike somali government,1256,agree
nun complains of stomach pains and gives birth sister who had idea she was pregnant has a baby boy at hospital in italy,1412,agree
tropical spider burrows under man skin lives there for three days,1819,agree
aaron sorkin confirms christian bale will play steve jobs,1215,agree
bali spider burrows under aussie chest,986,disagree
big bank hank us rapper and sugarhill gang founder member dies at 57,2351,agree
isis executioner john named by media,2165,discuss
teen made 72 million trading stocks confirms teen dominance worldwide,607,agree
boko haram kidnapped girls have been married off truce never happened,1885,agree
this soap opera star reportedly had his testicles stolen by an blonde organ trafficker,516,discuss
forty years ago lego wrote a powerful letter to parents about how gender works,1582,agree
russian tv actor wakes up to find his testicles stolen,1231,agree
accidentally delivered weapons to the islamic state by airdrop militants say,2200,discuss
watch us marine saved by helmet after being shot by taliban sniper,1481,agree
an audio recording of the michael brown shooting has reportedly surfaced,2345,discuss
isis militants have contracted ebola iraqi kurdish media reports,2180,discuss
banksy arrest hoax us website claims street artist caught in watford,2362,agree
two gop congressmen say suspected terrorists caught crossing border,2385,discuss
calm yourselves durex has not come out with a pumpkin spice condom,1833,agree
michael brown shooting audio caught on tape,2235,discuss
microsoft hires robocops to guard silicon valley hq,2529,agree
islamic state training fighter pilots in captured jets monitoring group says,162,discuss
american predator drone circling islamic state stronghold,2443,discuss
video purports to show beheading of journalist by militants,1116,discuss
pure evil islamic state beheads american journalist james wright foley,1747,agree
attorney new audio reveals pause in gunfire when michael brown was shot,816,agree
squished perth experts debunk spider burrowing claims,2293,discuss
no a spider probably did crawl through a man body for several days,1321,agree
isis executioner john named by media,2349,discuss
former british rapper reportedly under investigation for james foley beheading,951,discuss
apple watch battery life currently a day but may improve for 2015 launch,1898,discuss
small meteorite strikes in nicaragua capital city of managua,1573,disagree
man has his penis cut off by angry mob after rape of teenager,1959,agree
us uk eye rapper as militant who beheaded journalist james foley,1079,discuss
banksy arrest hoax us website claims street artist caught in watford,2051,agree
islamist websites claim woman kidnapped by is report,2471,discuss
isil beheads american photojournalist in iraq,446,discuss
islamic state killer john named as mohammed emwazi,1219,agree
has ebola infected isis militants in mosul,2060,discuss
missing american journalist reportedly beheaded by islamic state,1288,discuss
banksy arrest hoax us website claims street artist caught in watford,709,agree
nyc relaxes response to marijuana possession,2163,agree
isis fighters getting caught coming across the border,2261,discuss
moment michael brown was shot dead on audio recording fbi handed potentially damning tape of eleven shots being fired including final volley of shots,2287,discuss
bunbury local discovered a spider had burrowed under his skin on bali holiday,1797,disagree
nigerians doubtful of girls release after boko haram breached,2356,discuss
the iphone 6 is not a thing,1738,discuss
cbi registers conspiracy case against dera chief after claims 400 male followers were forcibly castrated,2336,discuss
cnn airs alleged audio from michael brown shooting,1916,discuss
kim in charge kim sister north korean dictator during illness,2470,discuss
two gop congressmen say suspected terrorists caught crossing border,2385,discuss
report nearly a dozen commercial airliners missing ahead of anniversary after islamists overrun libyan airport,653,discuss
fears islamic state could launch ebola attack on britain after fighters virus,2003,discuss
isis reportedly beheads american photojournalist in iraq,2450,discuss
cnn plays alleged audiotape of michael brown shootingmilitarization of police,1934,discuss
a bogus banksy,1357,agree
eyewitness viral video that netted 130k in donations is bullshit,1996,disagree
contest leads to hospital stay,741,agree
tropical spider burrowed under man skin through appendix scar and lived there for three days,1579,discuss
man chops off his own penis after girlfriend told him he was no good in bed,827,agree
see it california homeless man uses 100 gift to give food to others,1130,disagree
isis leader in us airstrikes,1634,discuss
michelle obama hair appeared totally uncensored on saudi tv,1742,agree
dead for 48 minutes catholic priest claims god is female,2240,agree
report secret service lied about white house fence jumper,843,discuss
michael phelps girlfriend taylor lianne chandler reveals she was raised as a boy,1342,agree
mass grave found after 40 students disappear in mexican protest,695,discuss
the condom is just a figment of your own gross imagination,2252,agree
officials report that area town is under ebola quarantine is false,968,agree
boko haram ceasefire ignored as violence flares in borno state,1761,discuss
more american weapons for isis,2307,agree
lebanon confirms holding isis chief kin,2268,discuss
doubts cast over nicaragua meteorite claim,1661,discuss
boko haram agrees to ceasefire release of school girls,1099,disagree
google said to buy redwood city offices for 585 million,2442,discuss
james foley american journalist james wright foley beheaded in new isis video breaking news,481,discuss
militant group says it killed american journalist in syria,2047,discuss
christian bale wo play steve jobs,2455,discuss
police looking for a man that slaps people when they sneeze,1952,discuss
texas truck winds up in syria with islamic militants,2242,agree
if only a bird really did poop on putin,1957,agree
macaulay culkin victim of another online death hoax,804,agree
wtc rats scare off anna wintour,1543,discuss
youngest martyr the cub of isis boasts a fighter has been killed as he went into battle with his father in syria,299,discuss
iraqi health official ebola has killed 5 isis fighters,1669,discuss
us marine survives headshot from taliban video,1180,agree
video shows isil beheading of photojournalist james foley,1679,discuss
scorned wife leaves husband and twin sister naked in car park,1852,agree
send in the drones predator drones flown over is headquarters in syria,1159,discuss
nigerians doubtful of girls release after boko haram breached,2139,discuss
christian bale quits steve jobs movie,1841,agree
banksy illustrated response to the charlie hebdo attack is by banksy but it is striking,2024,agree
seth rogen to star as steve wozniak in sony steve jobs biopic updated,1262,discuss
duncan hunter least 10 isis fighters caught at mexican border,2249,discuss
ypg confirms gill rosenberg not captured in kobani,2471,discuss
tropical spider burrowed under man skin through appendix scar and lived there for three days,2338,discuss
report alleged new audio of michael brown shooting,2235,discuss
this is why rumors that isis is crossing the border into the are going away,134,discuss
hope fades for girls release after boko haram breached,1885,agree
mps credit for saving lives in parliament hill shootings,1121,discuss
isil beheads american photojournalist in iraq,337,discuss
does vogue new office have a rat infestation,2106,discuss
mass grave found after 40 students disappear in mexican protest,1795,discuss
saudi arabian cleric issues fatwa against snowmen,2167,agree
the rapper the hacker and the terror travel guide writer is one of these british extremists jihadi john three potential islamic state emerge as mi5 in on murderer who beheaded journalist james foley,2528,discuss
predator drones being flown over isil syrian,1509,discuss
7 teen girls get pregnant on school trip read more at http,2504,agree
isis claims to have captured us airdrop weapons,2200,discuss
despite ceasefire announcement new boko haram attacks reported,2530,discuss
boko haram agrees to ceasefire release of school girls,1340,disagree
fears journalist james wright foley beheaded by islamic state jihadists in to united states,1744,discuss
macaulay culkin dead actor once again victim of death hoax,2502,agree
israeli canadian fighting isis posts on facebook i safe and secure,1106,discuss
isis beheads photojournalist james wright foley in a massage to us to end its intervention in iraq,782,agree
what we know about kim yo jong who may control north korea,1294,discuss
islamic state militants claim to have beheaded us journalist james wright foley,1116,discuss
apple watch takes two hours to charge only delivers notifications while on the wrist,1542,discuss
in kim jong un absence his sister may rule or not,2344,discuss
isis appears to behead american photojournalist in youtube video,2047,discuss
james foley remembered as and tireless journalist,2047,discuss
accountant claims comcast got him fired from his job for reporting a customer service issue,1007,discuss
hostage luke somers killed during yemen rescue bid family,2247,discuss
pentagon somali terror group leader killed in airstrike,1835,discuss
boko haram kidnapped girls have been married off truce never happened,1821,agree
nicaragua says meteorite probable cause of blast in capital,1790,discuss
rapper identified as james foley executioner reports,546,discuss
james foley missing american photojournalist reportedly executed by isis in syria,933,discuss
macaulay culkin victim of another online death hoax,1555,agree
matt taibbi disappears from omidyar first look media,2218,discuss
batmobile not stolen mtv contest prize remains unclaimed,2135,agree
kim to open a new restaurant in scotland,2148,discuss
suspected meteorite leaves crater in managua is linked to asteroid,1213,discuss
durex is not making pumpkin spice condoms after all a hoax debunked,740,agree
a mass grave points to a student massacre in mexico,2342,discuss
macaulay culkin death claims about former child star revealed to be yet another hoax,2502,agree
jeh johnson shoots down duncan hunter assertion is is entering via mexico,1185,discuss
islamic state killer john named as mohammed emwazi,2349,agree
christian bale will not play steve jobs,1215,disagree
was nbc meteorologist mike seidel peeing in the snow on camera a testy brian williams explains,1319,discuss
hundreds of palestinians flee as israel opens dams into gaza valley,1965,disagree
tourist wakes to find strange red trail on his stomach and discovers a spider has burrowed through his appendix scar and crawled under his skin while on holiday in bali,800,discuss
the internet tried to make axl rose its latest death hoax victim,2525,agree
isis desperate mum told just eaten your son after visiting militants base in search of kidnap victim,2219,discuss
macaulay culkin dead internet death hoax claims actor found dead in apartment,2326,agree
christian bale to play steve jobs in new movie,2343,discuss
is kim sister kim running north korea in his mysterious absence,1294,discuss
us officials video shows american execution,694,discuss
isil beheads american photojournalist in iraq,1116,discuss
big bank hank us rapper and sugarhill gang founder member dies at 57,824,agree
isil video claims beheading of kidnapped journalist james foley,1093,discuss
chugging eggnog sends utah man to hospital,667,agree
isil beheads american photojournalist in iraq,1016,agree
apple retina macbook air shown in artist renditions,1344,discuss
rapper big bank hank of sugarhill gang dies at 57,993,agree
ios 8 bug reportedly erases icloud drive documents when settings are reset,2423,discuss
cheeky vandals paint giant penis on bonnet of million bugatti veyron sportscar,498,agree
ann arbor pizza delivery driver surprised with tip,676,agree
conde nast rat problem at one world trade centre from red carpets to rodent droppings,1045,agree
unconfirmed reports saying isis uk hostage david haines beheaded,2440,discuss
incredible video shows a us marine surviving being shot in the head by a sniper in afghanistan,2267,agree
christian bale in talks to play steve jobs in danny boyle biopic,1299,discuss
video son stuns parents by paying off their mortgage as christmas surprise,1599,discuss
boko haram denies ceasefire says kidnapped girls are now married,2272,discuss
kim to open a new restaurant in scotland,1873,discuss
mps credit for saving lives in parliament hill shootings,1472,discuss
ebay developing apple watch software with ties to ios app,796,discuss
gill rosenberg former idf soldier possibly captured by isis while fighting with kurds,756,discuss
homeless man who became a youtube sensation after spending 100 on food for his beggar friends gets a surprise christmas meal makeover and night in a hotel in new video but is it all a hoax by a prankster,2061,discuss
hope fades for girls release after boko haram breached,2272,agree
that boko haram ceasefire in nigeria is a ceasefire,1195,discuss
report claims kim underwent surgery to repair fractured ankles,856,discuss
islamic state militants claim to have beheaded us journalist james wright foley,1580,discuss
kim dine with me porky president kim to open uk restaurant serving dog,2418,discuss
report tom brokaw wants brian williams fired,1794,discuss
batmobile stolen from v superman dawn of justice set report claims that one of the batmobile models is missing detroit locals responsible,684,discuss
north korean leader kim mystery illness actually two broken ankles newspaper says,1001,discuss
iraqi media isis militants have contracted ebola,1904,discuss
dog found abandoned with suitcase filled with his belongings,2523,agree
mexico hit by student massacre at least 17 protesters up murdered and dumped in a mass grave and another 26 are missing,2342,discuss
video islamic state claims to have captured us weapons airdrop near kobane,2168,discuss
that boko haram ceasefire in nigeria is a ceasefire,1681,discuss
jihadi john named as mohammed emwazi from west london,2123,discuss
audio recording of michael brown being gunned down was made at the time he was killed app company appears to confirm tape of eleven bullets being fired including final volley of shots,2345,agree
report possible audio tape of michael brown shooting,2235,discuss
is militant john named as mohammed emwazi from london,2165,agree
nun gives birth intends to keep baby,1720,discuss
fidel castro rumors sweep internet but no sign in cuba,2251,discuss
obama denounces james foley execution the entire world is appalled,1206,agree
catholic priest dies for 48 minutes comes back to life and claims god is female,1549,disagree
bombing had signed my death certificate missing us journalist james wright foley goes unflinching to his death as isis behead him in horrific video as a warning to obama,1589,agree
tropical spider burrows under man skin lives there for three days,2293,discuss
isis claims to behead us journalist,1744,discuss
is beheads briton david cawthorne haines threatens to execute another briton alan henning,2440,agree
british man pays 460 to save constipated goldfish life,1541,agree
new policy could reduce marijuana possession arrests,2217,discuss
islamic state beheads missing american journalist james wright foley,2450,agree
six months after abducting nigerian schoolgirls boko haram reportedly wants to free them,2463,discuss
no a spider probably did crawl through a man body for several days,1880,agree
boko haram denies it has agreed ceasefire,2144,discuss
islamic state claims it executed american photojournalist james foley,2147,discuss
kim sister takes control in north korea,2473,discuss
nigeria says it has deal with boko haram to release kidnapped girls,2403,discuss
vice media ceo shane smith spent on las vegas dinner report,1682,discuss
us probing claims isis fighters seized airdropped weapons meant for kurds,1010,discuss
mechanical polar bear with asbo for singing christmas songs,1205,discuss
spider burrowed into appendix scar crawled through wa man body,1579,discuss
nigeria boko haram reach ceasefire deal kidnapped girls to go free official says,1761,discuss
luke somers american hostage is killed during rescue attempt in yemen official says,1844,discuss
angry mob cut off rapist penis with meat cleaver viewer discretion,2115,agree
fidel castro dead yes he but the cuban leader is alive death rumors proven false,2251,discuss
isis border crisis dhs chief says terrorists not entering us through mexico,1890,agree
islamic state killer john named as mohammed emwazi,939,discuss
detroit police issue statement that the batmobile is safe,2135,agree
star wars the force awakens to be released this summer,1843,discuss
islamic state beheads missing american journalist james wright foley,1948,discuss
willie nelson dead internet freaks out as another celebrity death hoax makes the rounds,1503,agree
saddam hussein pilots training islamic state group,1606,discuss
small meteorite hits managua,1661,discuss
nigeria says it struck a with boko haram but are they talking to the right guy,62,discuss
woman ting su finds husband cheating with her own twin gets spectacular revenge,1058,agree
turkish president says american weapons drop for kurdish fighters was after supplies end up in the hands of isis,2307,agree
no that was paul rudd tackling an airport homophobe,1735,agree
isis pays tribute to its of baghdadi child soldier,1785,discuss
durex is not confirming or denying rumors of a condom,1833,discuss
isis beheads photojournalist james wright foley in a massage to us to end its intervention in iraq,1589,agree
batmobile stolen in detroit good one joker,1313,agree
unconfirmed reports saying isis uk hostage david haines beheaded,2241,discuss
reports isis fighters have contracted ebola are says iraqi health ministry,1807,discuss
report alleged new audio of michael brown shooting,2250,discuss
missing jetliners raise fear of new attacks after libyan airport falls to islamic militants,170,discuss
missing mexican students found in mass grave,1795,agree
report michael phelps tinder was born male made love during,1342,discuss
rapper identified as james foley executioner reports,1530,discuss
return of the mac seth rogen in talks to star as apple steve wozniak in upcoming steve jobs biopic,1002,discuss
reports of missing libyan planes raise terror fears,2448,discuss
tropical spider burrowed under man skin through appendix scar and lived there for three days,986,disagree
these lego instructions from 1974 are awesome and yes they real,1292,agree
nicaragua meteorite impact theory may be,1913,disagree
wtc rats scare off anna wintour,1619,discuss
isis we have our hands on weapons ammo by,2168,discuss
continuing violence puts boko haram ceasefire in jeopardy,837,discuss
macaulay culkin dead actor once again victim of death hoax,198,agree
apple macbook air details emerge device could be thinner lighter than current model,2039,agree
lawmaker says least islamic state fighters have been captured at the southern border,871,discuss
electric shock turns russian boy into marvel magneto,388,agree
breaking news isis beheads missing american journalist james wright foley as warning to us to cease action in iraq,1747,agree
small meteorite strikes in nicaragua capital city of managua,185,discuss
batmobile stolen in detroit good one joker,684,agree
gill rosenberg woman feared kidnapped by isis says she safe,2037,agree
photo gallery amazing operation by north walsham vet on constipated goldfish,1541,agree
nigerians doubtful of girls release after boko haram breached,2530,discuss
video purports to show beheading of journalist by militants,1744,discuss
news sites fall for putin video,1051,discuss
pants on fire duncan hunter makes unconfirmed claim border patrol caught at least 10 isis fighters,2385,agree
sugarhill gang big bank hank dies,2351,agree
iraqi and kurdish media reports isis fighters have contracted ebola,1904,discuss
new audio recording from ferguson may capture michael brown shooting,1934,discuss
kim hospital with two fractured ankles after ballooning to around 20 stone and going on numerous the people walkabout pr stunts,1465,discuss
alleged audio of michael brown shooting released,2345,discuss
batmobile stolen from batman v superman dawn of justice set zack snyder knows who did it,1751,disagree
cnn audio is this the moment michael brown was shot,1692,discuss
james foley american journalist james wright foley beheaded in new isis video breaking news,933,discuss
terrorism fears rise amid reports of stolen jetliners,1865,discuss
christmas is cancelled pumpkin spice condoms are a goddamn hoax,2055,agree
islamic state training fighter pilots in captured jets monitoring group says,630,discuss
pentagon denies it killed isis chief as airstrikes hit top extremists,1473,disagree
gene munster predicts 499 steel apple watch for 18k gold edition,1280,discuss
michelle obama face blurred by saudi state television,1742,disagree
apple watch gold edition may cost as much as,570,discuss
congressman least 10 isis fighters caught trying to cross into us,871,discuss
newly discovered mass grave linked to missing mexican students,1795,disagree
tribunal confirmed in texas,1436,discuss
has the batman superman batmobile been stolen in detroit,1737,discuss
abdel majed abdel bary emerges as suspect in foley beheading,850,discuss
israel denies causing gaza floods by opening dams,1803,disagree
the man who says comcast got him fired has filed a lawsuit,2438,discuss
rare meteorite impact causes blast in nicaragua capital managua,715,discuss
isis claims to behead us journalist,1747,discuss
lebanon is leader daughter and,1192,discuss
kimye fault anna wintour nyc offices hit with disgusting rat infestation droppings on desks,1619,discuss
kimye fault anna wintour nyc offices hit with disgusting rat infestation droppings on desks,834,agree
rcmp release security footage of michael zehaf bibeau during attack say he shot soldier in back,1380,agree
report nigerian woman quarantined in kc with symptoms video,1343,discuss
us officials video shows american execution,608,discuss
dylan thomas finds tropical spider burrowed under skin,1602,discuss
cnn airs alleged audio from michael brown shooting,1446,discuss
did nbc nightly news go live to a man who was taking a piss,1968,discuss
espn to save nfl image with domestic abuse discussion,1370,discuss
cnn plays chilling audio recording allegedly from michael brown shooting least 11,944,discuss
mass graves found in mexico near place where 43 students went missing,2334,discuss
vandals add rude paint job to bugatti but luckily for the owner it all turned out to be a hoax,1320,discuss
christian bale drops out of steve jobs biopic,1846,agree
an accidental delivery of arms to the islamic state and the problem with airdrops,2404,discuss
us intel taliban man released from gitmo in bergdahl deal is back to militant activity,2236,discuss
islamic state claims to have beheaded american journalist,1744,discuss
how did a texas plumber truck end up with syrian rebels,2379,agree
christian bale passes on role of steve jobs actor reportedly felt he was right for part,2017,discuss
how canadian kevin vickers killed shooter in parliament,1121,discuss
david haines beheaded by isis execution video contains threats against uk reports,1097,agree
confusion surrounds capture of leader,2337,discuss
gop rep least ten isis fighters have been caught coming across the mexican border,2367,discuss
hundreds mourn the of fidel castro after rumours sweep twitter but are they confusing him with recently departed fidel castro odinga from nairobi,2221,discuss
mcdonald will stop serving overweight customers beginning,1848,agree
isis militants appear to behead abducted american journalist james wright foley in graphic video,1471,discuss
rare meteorite impact causes blast in nicaragua capital managua,885,disagree
boko haram denies it has agreed ceasefire,2356,discuss
gop rep least ten isis fighters have been caught coming across the mexican border,2093,discuss
audio recording allegedly captures moment michael brown was shot,1692,discuss
american hostage in yemen freed in military ministry,826,discuss
saddam hussein pilots training islamic state group,2406,discuss
cbs news names canadian parliament shooting suspect,1554,discuss
was the video of that homeless man doing good deeds with 100 all an elaborate hoax,794,agree
hope fades for girls release after boko haram breached,1896,discuss
new audio recording from ferguson may capture michael brown shooting,1564,discuss
taylor lianne chandler michael phelps cougar girlfriend revealed,2454,discuss
james wright foley kidnapped journalist apparently executed by isis,1011,discuss
michael slain ottawa shooter had criminal record in quebec,1178,discuss
does isis have an airforce terrorist pilots are being trained on captured migs by saddam hussein force officers,2406,discuss
tropical spider burrows under man skin lives there for three days,761,agree
video shows isil beheading of photojournalist james foley,726,agree
white house fence jumper pushed past female guard,2303,discuss
isis appears to behead american photojournalist in youtube video,933,discuss
ypg confirms gill rosenberg not captured in kobani,2037,agree
congressman least 10 isis fighters caught trying to cross into us,2367,discuss
mohammed emwazi man identified as isis killer john was by mi5 while on safari holiday in africa in 2010,1374,agree
isis extremists claim to behead british hostage david haines,2102,discuss
oscar winner christian bale to play steve jobs in upcoming biopic,428,discuss
kfc gets occupational business license to sell marijuana in colorado restaurants kfc gets occupational business license to sell marijuana in colorado restaurants,1814,disagree
amazon is opening a store in manhattan,941,discuss
